{
  "$schema": "../../instruction_spec_schema.json",
  "name": "mul",
  "description": "Unsigned multiply",
  "arch": "x8664",
  "encoding_spec": {
    "formats": [
      {
        "name": "RegMemReg",
        "description": "Multiply register or memory",
        "operand_pattern": "r/m",
        "opcode": [245],
        "modrm_required": true,
        "rex_prefix": true
      }
    ],
    "default_format": "RegMemReg"
  },
  "operands": [
    {
      "name": "src",
      "op_type": "regmem",
      "direction": "read",
      "description": "Source operand"
    }
  ],
  "semantics": {
    "effect": "rdx:rax = rax * src",
    "flags_modified": ["CF", "OF"],
    "exceptions": ["#DE", "#GP", "#BP"]
  },
  "aliases": ["MUL"]
}
